1,20210709_00:07:00,surrealwyvern,personality?,1,5.4943404,6.240953
2,20210709_00:07:04,kolldemon16,i want to marry you,1,8.3561,6.877837
3,20210709_00:07:05,wakyeggs,Do you prefer Microsoft teams or only fans?,1,8.259407,8.826782
4,20210709_00:07:33,w1nth4r,Do u have onlyfans?,1,8.27647,9.548612
5,20210709_00:07:47,thuggypark21,Yo you strip?,1,5.8772817,6.6304727
6,20210709_00:08:03,xthatsarcan,YOU WERENT BANNED?,1,8.348879,8.430781
7,20210709_00:08:14,tr4v1ez033,Rick wanna play!!!!,1,7.0142546,8.9874735
8,20210709_00:08:24,blackm2580,they are not blessed like u not a Si___Mp,1,7.688055,6.5394053
9,20210709_00:08:25,marceloseminario,wtf,1,6.594705,4.3886137
10,20210709_00:08:37,mimsfx,Hi from France @Amouranth,1,7.349457,6.88943
11,20210709_00:08:40,potatosloth123,can you do a pin?,1,6.9204535,9.15734
12,20210709_00:08:47,angelblazingars,Do you ever read chat?,1,8.301707,7.0273733
13,20210709_00:08:48,zexifyyyyyyy,you ass is fat,0,8.330058,5.3513165
14,20210709_00:08:51,potatosloth123,can you do a spin?,1,7.218626,9.332439
15,20210709_00:08:56,potatosloth123,do a spin,1,7.1681232,9.424588
16,20210709_00:08:56,aiden_x2,u hot,1,8.931416,6.476485
17,20210709_00:09:11,aiden_x2,u hott,1,8.293823,6.0866847
18,20210709_00:09:12,dontellmetheodds,mods are in fire,1,7.7123938,6.6203346
19,20210709_00:09:13,thehadeskid,dad?,1,5.5814276,6.21925
20,20210709_00:09:18,nnydust,can you go underwater in a roll with Rick?? and back out?,1,6.7579722,8.739108
21,20210709_00:09:26,ahmedessamahmed,WTF,1,5.2240605,5.6603684
22,20210709_00:09:32,potatosloth123,do a spin,1,7.211772,9.373087
23,20210709_00:09:42,p0six_,good Lord LUL,1,6.71386,5.7251806
24,20210709_00:09:52,tejbetokp12,atr akarod hogy meg kúrjanak nem??,1,7.754814,8.345046
25,20210709_00:09:58,boron421,Is your foot better btw?,1,7.237894,9.193024
26,20210709_00:10:01,xenopphole,fart in my inhaler,1,7.7085376,5.853741
27,20210709_00:10:05,lyssword,@Amouranth do you play age of empires 2? xD,1,7.2201915,7.967886
28,20210709_00:10:06,iantheveiwer,e,1,6.985016,4.658299
29,20210709_00:10:10,emileokaan,lmao is the water wet tho?,1,9.4953375,7.394344
30,20210709_00:10:18,portsariporro,í want be famous snapchat: aukku10,1,7.752357,6.6318607
31,20210709_00:10:24,bluntlung,You are looking spectacular little lady,2,9.317464,6.0759945
32,20210709_00:10:40,plk_fn,me voy a pajear adios chat,1,8.11349,6.4099827
33,20210709_00:10:46,ahmedessamahmed,WTF,1,5.2159753,5.608546
34,20210709_00:10:59,m4dbe4st,are u thick,1,8.854527,8.23502
35,20210709_00:11:00,blagonblood,ammoDarth2 is it even safe in chat lol,1,7.9051843,6.874068
36,20210709_00:11:09,emileokaan,pls guys follow me,1,5.9614487,8.096774
37,20210709_00:11:26,emileokaan,follow me if u wanna see,1,6.01106,8.197764
38,20210709_00:11:50,chuuniboyo,built like a fridge,1,6.720295,5.769151
39,20210709_00:11:53,mura154,wtf is this?,1,5.75519,5.151329
40,20210709_00:12:00,m4dbe4st,ur chat is a hole bunch of simps,0,8.059821,6.3251534
41,20210709_00:12:08,kingzfullz,THATS A HOT TUB??,1,9.274573,6.8071218
42,20210709_00:12:14,vensoth_,do you have only fans ?,1,8.030902,9.297427
43,20210709_00:12:15,hyperdecay,Gift me,1,6.268448,5.713583
44,20210709_00:12:21,therealmarselo,are you gamer girl,1,9.514575,8.531778
45,20210709_00:12:49,kingfeetx,como cambiara el agua? jshshs,1,8.482695,7.8948555
46,20210709_00:12:52,slart1bartfast,look trashy?,1,5.677352,6.4659934
47,20210709_00:12:54,potatosloth123,is that a bra?!?!?!?,1,7.718667,8.464493
48,20210709_00:12:57,luxarapl,U realise u have kno9w fans thete All waming to you,1,7.9911947,9.32324
49,20210709_00:13:06,therealmarselo,are you girl?,1,9.59784,8.522614
50,20210709_00:13:10,taonip,NOAH CAN YOU HEAR ME,1,8.434291,8.992055
51,20210709_00:13:12,danneeee_,That bunda is big sheesh,1,7.620845,5.440384
52,20210709_00:13:19,taonip,THE BABY ARE YOU THERE,1,6.780853,6.713817
53,20210709_00:13:25,parseltongueplayer,your scared of needles huh? lol,1,8.263577,7.766442
54,20210709_00:13:27,1709_juan_1709,que cul,1,7.4805403,5.5228353
55,20210709_00:13:36,ajespi520,you never get the Down under priced?,1,7.0096636,8.88151
56,20210709_00:13:41,andtheskip,You typa women ruin twitch,0,7.786051,6.923767
57,20210709_00:13:55,hyperdecay,Any gifters,1,6.094573,5.630193
58,20210709_00:13:58,nahuel553154,pasa ig,1,7.064073,5.5560665
59,20210709_00:14:00,adywlkr,Any Cosplay coming up??,1,7.960596,7.8867245
60,20210709_00:14:37,maxifuskk,a cuanto el only?,1,6.374502,6.6330605
61,20210709_00:14:43,therealjamyyyy,come in Italy,1,7.1313677,5.9854755
62,20210709_00:14:45,mangetonsiip,Paris ?,1,5.7450814,6.16957
63,20210709_00:14:49,bimbo135,was you anal??yg,1,8.581241,7.4419684
64,20210709_00:14:51,kobedalemans,doe je alles uit,1,7.7598343,5.83592
65,20210709_00:14:56,bieberhole25,Anyone else have a huge pickle right now?,1,5.8181324,9.12738
66,20210709_00:15:00,fabiett932,Do you like italy?,1,8.184926,7.7389903
67,20210709_00:15:04,sarah18_11,italies pizzas are not so good,0,7.6265626,7.1204658
68,20210709_00:15:17,albagrande99,ITALY NUMBER ONE,1,7.0193377,5.4002156
69,20210709_00:15:20,badchinchilla,the question is will the cucumber pop,1,6.6790376,9.330931
70,20210709_00:15:29,rqnji,wanna be my wifey?,1,7.64572,8.875555
71,20210709_00:15:34,fabiett932,Do you like italy?,1,8.126448,7.7830977
72,20210709_00:15:34,panic1atyourdisco,you are gonna love cyprus during summer,2,8.232925,7.415158
73,20210709_00:15:46,onatbey31,do you like turkey?,1,8.217264,8.364133
74,20210709_00:15:52,happydolphiin,Texas leggoo,1,6.6123524,5.373015
75,20210709_00:16:00,army_rbc2k,do you like Switzerland?,1,7.9555883,8.0663805
76,20210709_00:16:11,whizyhz,only fans?,1,8.106061,9.40277
77,20210709_00:16:15,griso_7143,MOD CAPITE LITALIANO?  DOVREBBE FARE LA PORNOATTRICE,1,7.226143,6.4374046
78,20210709_00:16:16,g3tsmart07,your white watermelon is so sweet,2,8.27392,6.8720956
79,20210709_00:16:17,matt_starr90,are you from canada?,1,6.8815694,8.639342
80,20210709_00:16:36,ripbenny,amouranth quick question do you toes get pruned sitting in the water like that?,1,9.004495,7.7341757
81,20210709_00:16:37,nnydust,sus is me Jesus right chat?,1,7.4538713,8.229366
82,20210709_00:16:40,viictorhugo0,br ?,1,6.700693,5.929903
83,20210709_00:16:51,potatosloth123,are you married!?!????!,1,8.342415,7.978479
84,20210709_00:17:01,dawbiel0,Zrobisz loda ?,1,7.8687816,8.667871
85,20210709_00:17:12,dawsonvoid,is that dookie on her ass?,1,10.524876,8.96025
86,20210709_00:17:13,chiefperilous,She is married to Twitch,1,7.4400215,6.6449943
87,20210709_00:17:15,titan2u_,that azz is kinda sus :/,0,7.2983904,5.7675314
88,20210709_00:17:15,happydolphiin,Big booty Jody,1,7.216569,5.7548876
89,20210709_00:17:17,aatkins11,Is that a freckle on her ass or is my phone dirty?,1,7.430314,9.014816
90,20210709_00:17:47,dsmp_fangirl12,Can u pull the bottom down a little,1,7.023502,8.964359
91,20210709_00:17:52,moonpoy,can you do an ahegao,1,7.3203917,8.765652
92,20210709_00:17:53,ee96,are those followers real? thats insane,0,7.24886,8.710066
93,20210709_00:17:54,1cliffbooth1,fart,1,7.0174303,5.119044
94,20210709_00:18:38,willsly123,Does anyone ever get the name on forehead perk?,1,6.486658,8.723298
95,20210709_00:18:44,jesucelesprofs,have you ever had your ass fucked by a hors,0,8.033913,8.261387
96,20210709_00:18:53,isaiah_thagoat10,Everyone here is a simp for big booty girls,1,10.615318,8.735105
97,20210709_00:18:59,petak81,je tu Richard ?,1,5.8945384,8.092595
98,20210709_00:19:17,kixxah,Which ban will be the perma ban?,1,6.6334977,7.709003
99,20210709_00:19:25,gianlucagua,Plssss there are kids in here,1,7.488707,5.96484
100,20210709_00:19:30,theman_themyth_villads,damn lookiong like u need me to sit behinmf you???,1,7.6854863,8.701459
101,20210709_00:19:36,l1gercs,baka pwedeng basain yung ytnap?,1,7.141185,6.3746843
102,20210709_00:19:37,fluxinng,you are sexy escort,2,9.123023,6.2009416
103,20210709_00:19:54,theman_themyth_villads,can i get a fart,1,8.637103,7.357292
104,20210709_00:20:02,bluntlung,This guys is a beautiful woman,2,8.884114,6.4421725
105,20210709_00:20:08,zarox010,fat ass SeemsGood SeemsGood,1,8.260862,5.2940283
106,20210709_00:20:15,lautaro_xlx,aca es la paja grupal?,1,6.3199196,7.488326
107,20210709_00:20:16,srvrdmn,Got any purple?,1,5.726144,6.271215
108,20210709_00:20:25,hugook_,tu suce ?,1,7.6850224,7.7976246
109,20210709_00:20:25,ch_oi1,Rick it’s you?,1,7.169327,8.953686
110,20210709_00:20:30,vincenzom0,AOO A ITAS TORNATE A VEDERVE ER TOCCO,1,7.132562,5.5025344
111,20210709_00:20:35,tchoupie_chakal,fat ass,0,8.077466,5.1108494
112,20210709_00:20:37,fredybanneado,WTF?,1,5.1287503,5.882823
113,20210709_00:20:39,phantomslikeamf,Texcinian?,1,5.8890557,5.9069767
114,20210709_00:20:44,fredybanneado,legal weed at texas?,1,6.411238,6.025038
115,20210709_00:20:49,erobbscohmrag,KkonaW TEXAS,1,6.9219904,5.417519
116,20210709_00:20:49,littlemagicbeast,so you are cowboy girl?,1,9.395283,8.541462
117,20210709_00:21:11,bluntlung,In texas cannabis is illegal SeemsGood k,1,7.163117,6.1492805
118,20210709_00:21:14,b3rto1,big ass nicee,2,7.9747086,5.115893
119,20210709_00:21:18,tchoupie_chakal,you have a big ass,1,8.366925,5.428594
120,20210709_00:21:21,fredybanneado,u work at bangbros?,1,6.493704,6.600445
121,20210709_00:21:22,adamkacem14,i wanna lick that ass,0,8.024854,5.991957
122,20210709_00:21:28,theman_themyth_villads,wanna play firetruck. i spray u scream,1,7.9474277,6.1266704
123,20210709_00:21:34,pingodapenguin_,Anybody fappin’?,1,6.306199,6.171
124,20210709_00:21:39,king100600,r,1,7.058932,4.8763037
125,20210709_00:21:45,rakketta,ma non ti annoi?,1,8.141679,7.9309597
126,20210709_00:21:52,scarlettfan1,Do you travel to comic cons ?,1,7.07029,8.735808
127,20210709_00:21:55,ramtin__king,yo wtf,1,6.4702673,4.351639
128,20210709_00:21:57,titan2u_,That Azz is kinda SUS :/,1,7.1295424,5.90792
129,20210709_00:22:04,potatosloth123,r u gonna chage bikini S,1,7.982205,6.4370003
130,20210709_00:22:08,erobbscohmrag,KKonaW WTF,1,5.248422,5.6885347
131,20210709_00:22:09,chuckkid3,I know you like goldfish did you know theres a red hot limited edition version?,1,7.298956,8.731887
132,20210709_00:22:13,anunnak1_,U SUCH A TALENTED GIRL GIFTED,2,7.2662387,5.6538854
133,20210709_00:22:20,shakingboar,Can you still marry a horse in Texas,1,6.0177026,9.34175
134,20210709_00:22:29,chuckkid3,whhaaaa??,1,5.371759,5.73946
135,20210709_00:22:30,czc_one_shot_uni,wait ur from texas?,1,6.1304183,5.7399764
136,20210709_00:22:31,marfewz,Have you ever camped?,1,-4.3389087,0.5194893
137,20210709_00:22:43,scarlettfan1,Is that bikini legal in Texas ?,1,7.6500316,7.6777983
138,20210709_00:22:43,sneaxxl_,ao e bannateme,1,7.7792,5.8882804
139,20210709_00:22:46,darth_rowe,Do you watch Rick and Morty?,1,7.5351048,8.889897
140,20210709_00:22:46,marfewz,Have you ever camped??,1,-4.314714,0.54403764
141,20210709_00:22:46,caseyh09,So theres no talent you just fking sit there?,0,7.5628395,9.015456
142,20210709_00:22:53,gucci_queenn,@bubbaplayz11 WTF??,1,5.2639537,5.824113
143,20210709_00:22:54,snakeadsa,1000subs name on the butt?,1,6.456311,8.731722
144,20210709_00:22:56,silentxchild,wtf is this,1,6.006637,4.85729
145,20210709_00:23:00,srvrdmn,Wait really?,1,5.4698296,6.1832576
146,20210709_00:23:04,that_foxxys0b,na that asss to fine,1,7.4824386,5.392842
147,20210709_00:23:15,clawname,huh?,1,5.3544197,5.9304447
148,20210709_00:23:22,vladofrankfurt,Which product of Germany do you like most?,1,7.575428,8.6473
149,20210709_00:23:27,moonpoy,do you have a pp?,1,6.120416,8.3781805
150,20210709_00:23:27,srvrdmn,Cow statues?!,1,5.675721,6.170892
151,20210709_00:23:29,flok1fn,you are my teacher hehee,1,8.053224,6.3920493
152,20210709_00:23:39,wynd13,hey is that pickle rick?,1,5.770291,9.229651
153,20210709_00:23:40,jacob2016lol,onlyfans??,1,6.3375177,5.841851
154,20210709_00:23:40,c_dag_gaming_fr,you are sus,0,8.238699,5.930048
155,20210709_00:23:48,marfewz,Have you ever camped?,1,-4.3230925,0.53529173
156,20210709_00:23:50,stewartriding,so many baddies in austin,0,7.648513,5.8819857
157,20210709_00:23:50,zzzemmanuelzzz,wtf asse,1,6.6213665,4.5914516
158,20210709_00:23:54,doyiezz,big one,1,7.440682,5.174222
159,20210709_00:23:54,thevulkanhestan,Are you happy to do all this?,1,8.573987,8.409891
160,20210709_00:23:57,soyjocaa,getting ban again?,1,5.8317137,7.4785542
161,20210709_00:24:03,lonegunman_967,cows are tasty,2,7.794648,7.1213064
162,20210709_00:24:05,argomael,But… cows are female…,1,6.3753023,9.120573
163,20210709_00:24:09,karotftn,qui m’offre un sub ?,1,6.1658645,8.26178
164,20210709_00:24:12,troyvalley,Texas Longhorns have Bevo,1,7.4867544,6.762663
165,20210709_00:24:15,john_blaze_42,Waitwaht? ammoMarty ammoLUL,1,6.9798045,6.30986
166,20210709_00:24:21,vladofrankfurt,Which product of Germany do you like most?,1,7.598118,8.287628
167,20210709_00:24:24,marfewz,Have you ever camped ??,1,-4.3746085,0.48428804
168,20210709_00:24:26,erp0zz0,we can escape in Malta together,1,7.6315603,6.839051
169,20210709_00:24:34,darth_rowe,Do you watch Rick and Morty?,1,7.5474854,8.886295
170,20210709_00:24:35,lone_flayer,SOULJABOY is streaming on twitch rn is this real??,1,7.520758,6.892446
171,20210709_00:24:44,gochugamers,isnt sitting like that bad for the posture?,1,7.370446,8.456565
172,20210709_00:24:49,thevulkanhestan,Are you happy to do all this?,1,8.5007105,8.502193
173,20210709_00:24:52,lone_flayer,have u seen loki,1,7.5892825,8.643471
174,20210709_00:25:00,pouyadark,Kos tar az in hast ?,1,6.675689,7.2025385
175,20210709_00:25:07,agresser17,Did you finish your painting?,1,7.81247,8.026212
176,20210709_00:25:08,xcloudydeadrodrigo,notice me,1,5.654424,8.322346
177,20210709_00:25:08,zoeanzalucca,hello chat,1,6.928907,5.880679
178,20210709_00:25:16,lone_flayer,have u seen stranger things,1,7.503743,8.769339
179,20210709_00:25:17,0samurai_ghost0,did u have any bad experience with followers??,1,7.6168723,9.080774
180,20210709_00:25:19,miounyfurrytale,on peit mexpliquer pk le premier truc que je voir sur twitch c un Q?,1,6.779123,7.3975897
181,20210709_00:25:50,hellrayn,shes on pickle rick right?,1,5.867198,9.191477
182,20210709_00:25:55,that_foxxys0b,ALL HAIRS RED?,1,5.8670354,6.24686
183,20210709_00:25:55,diegotrex2,que coño?,1,5.473929,7.293312
184,20210709_00:26:08,mnamkaaaa,u r really pretty,2,9.183332,5.857157
185,20210709_00:26:08,taonip,DONOVAN CAN YOU HEAR ME,1,8.253032,9.006761
186,20210709_00:26:09,macskafogo1,@Amouranth Asmr?,1,5.934638,6.739905
187,20210709_00:26:15,taonip,COLLIN CAN YOU HEAR ME,1,8.275086,8.903891
188,20210709_00:26:27,fonsecajose047,porn?,1,6.917951,6.2495494
189,20210709_00:26:29,letunche1,Njs vueyg oodube oosljd bdgjw yu,1,7.689147,5.813803
190,20210709_00:26:29,mnamkaaaa,can you play some games again? i enjoyed your gameplay,2,7.89302,8.73924
191,20210709_00:26:33,drewwxox,fart,1,7.0494413,5.083605
192,20210709_00:26:36,taonip,HELP ME AMOURANTH HAS ME TRAPPED,1,7.577002,6.2095995
193,20210709_00:26:36,that_foxxys0b,NA,1,6.997001,5.0796785
194,20210709_00:26:51,ig0r117,mi fai una sega?,1,6.8816423,8.769501
195,20210709_00:26:52,zzzemmanuelzzz,omg that ass is fat,0,8.282112,5.295772
196,20210709_00:26:52,ljwalsh15,@fonsecajose047 ???????m?,1,7.439713,6.6347384
197,20210709_00:26:58,parsaqsp,you are bi tch,1,8.007181,6.012792
198,20210709_00:26:58,mrcontable,dear Amouranth do you like cocaine?,1,7.5621924,7.321367
199,20210709_00:26:59,gizzetv,Can someone explain the purpose of this stream?,1,5.6268454,8.008296
200,20210709_00:27:03,romeopapathreefour,dont u all want a pool and a big thing to float on? :D i do... :D,1,7.4203396,8.609236
201,20210709_00:27:05,kingofkyrat697,Can you sign my cucumber too?,1,6.728629,9.144364
202,20210709_00:27:12,eldur9,bella me ni videmu quacchi iornu?,1,7.0852513,8.171857
203,20210709_00:27:15,omarrkh98,is it a hot tub stream or hot amouranth ?,1,9.185629,7.0682263
204,20210709_00:27:19,jocketan,är det någon mer än jag som runkar?,1,6.4936585,8.371272
205,20210709_00:27:21,robo_baby,Does it fart queen?,1,8.878009,7.4865236
206,20210709_00:27:24,anonymous_91v,are u social,1,8.034394,7.239498
207,20210709_00:27:28,thrashmaster1187,were you a good student in high school,1,8.570846,8.186213
208,20210709_00:27:32,chuckkid3,are you going to see black widow?,1,8.132829,8.575722
209,20210709_00:27:32,c_dag_gaming_fr,aime tu la bit€ ?,1,8.099794,7.9743204
210,20210709_00:27:35,ztoxichris,questa sta tutto il giorno così e fa soldi?,1,6.140263,8.299941
211,20210709_00:27:40,axetr00,Can you pls say something horney?,1,6.82418,8.10018
212,20210709_00:27:43,westhhh,@Amouranth are you lesbian,1,7.8772616,7.498414
213,20210709_00:27:43,balou487,Can you sign my cucumber too?,1,6.7348533,9.26176
214,20210709_00:27:47,jumaxviii,next ASMR stream ?,1,5.1030717,6.7326145
215,20210709_00:28:06,potatosloth123,can u spin,1,7.15791,9.301119
216,20210709_00:28:08,littlemagicbeast,are u from dallas,1,6.266868,6.5659037
217,20210709_00:28:08,thomas_england,hey wanna hangout?,1,7.3532195,7.4448733
218,20210709_00:28:15,robo_baby,amouranth my queen does it fart?,1,8.783268,7.569708
219,20210709_00:28:19,robo_baby,amouranth my queen does it fart? amouranth my queen does it fart?,1,8.755502,7.6496696
220,20210709_00:28:20,robo_baby,amouranth my queen does it fart? amouranth my queen does it fart? amouranth my queen does it fart? amouranth my queen does it fart?,1,8.724973,7.6025085
221,20210709_00:28:22,robo_baby,amouranth my queen does it fart? amouranth my queen does it fart? amouranth my queen does it fart?,1,8.620465,7.6070466
222,20210709_00:28:24,omarrkh98,i cant deside is it hot tub stream or hot amouranth stream?,1,9.1146555,7.091032
223,20210709_00:28:26,jumaxviii,next ASMR stream ?,1,5.108273,6.729657
224,20210709_00:28:36,rnzdias,Dont ur back hurts ?,1,6.9684887,8.623433
225,20210709_00:28:38,zoeanzalucca,is the water hot or cold,1,9.631503,7.2437315
226,20210709_00:28:45,littlemagicbeast,are u from Dallas or Austin,1,6.4456024,5.853441
227,20210709_00:28:47,taonip,Do it toot toot?,1,5.7987785,6.74544
228,20210709_00:28:49,frankluk_,non ti arrendi mai tu eh,1,7.6206355,8.381322
229,20210709_00:28:59,huskyruss,SMOL peepee gang wya?,1,6.9133315,6.1567593
230,20210709_00:29:00,thomas_england,hey wanna hangout? I respectr,1,7.701755,7.524399
231,20210709_00:29:01,marfewz,Have you ever camped ??,1,-4.3235035,0.53539664
232,20210709_00:29:05,taejjindda,You are so sexy,2,9.224627,6.1073256
233,20210709_00:29:08,mnamkaaaa,do you play league of legends?,1,7.4725933,8.833092
234,20210709_00:29:12,chico_purga_7u7,que dijo?,1,5.370847,7.1354403
235,20210709_00:29:13,game_seek,any updat on your 2nd ranch for the doggos??,1,6.437373,8.147299
236,20210709_00:29:14,magooies,YO THOMAS ENGLAND IS IN CHAT,1,6.8510833,5.585215
237,20210709_00:29:37,potatosloth123,CAN YOU DO A SPIN CAN YOU DO A SPIN CAN YOU DO A SPIN CAN YOU DO A SPIN CAN YOU DO A SPIN CAN YOU DO A SPIN,1,7.1532426,9.23876
238,20210709_00:29:43,chuckkid3,Will you see black widow?,1,7.951854,8.561419
239,20210709_00:29:53,littlemagicbeast,ARE U FROM DALLAS?,1,6.7240157,6.5845184
240,20210709_00:30:05,cartsop,Is that water actually warm?,1,9.557159,7.3181205
241,20210709_00:30:07,littlemagicbeast,DALLAS?,1,6.2778635,6.010815
242,20210709_00:30:07,fecund_loin,U R U,1,7.204086,4.9004703
243,20210709_00:30:10,nyuszika99,u liket league of legends?,1,7.9822783,8.430734
244,20210709_00:30:10,hajkal_,??????????????????,1,5.406789,5.7396126
245,20210709_00:30:10,maloey,the amount of deleted messages is insane,1,7.4527802,6.620351
246,20210709_00:30:15,littlemagicbeast,AUSTIN?,1,5.684283,6.027414
247,20210709_00:30:21,moonpoy,can I hold your hand?,1,6.44632,8.617496
248,20210709_00:30:22,jhon_thicc,i wanna smack that cake of yours,1,7.91628,6.292412
249,20210709_00:30:28,godhyr,wtf,1,6.5578017,4.3819833
250,20210709_00:30:30,thevulkanhestan,you think you can be usefull for many people? In any way?,1,7.007742,8.578066
251,20210709_00:30:31,devourprimary,Can I get vip?,1,6.668463,8.992441
252,20210709_00:30:34,damknix94,so question do you just sit in a blow up pool and talk to people in your bikini??,1,7.9939537,8.535694
253,20210709_00:30:36,coughingmcpay,@Amouranth will you go to Mayas Sanctuary?,1,7.2502,7.4442043
254,20210709_00:30:36,taonip,DO YOU WANNA PLAY SEA WORLD TYCOON 2 WITH ME PLEASE BABE,1,7.2684183,8.917758
255,20210709_00:30:38,jesuspika32,pinpepino????,1,6.2282543,6.696382
256,20210709_00:30:43,benkesh,do you go to a therapist?,1,7.303077,7.829296
257,20210709_00:30:44,clocked1x,this is the most down bad chat I have seen,0,8.016394,6.326262
258,20210709_00:30:50,rapid_999,Cringe???????,1,5.4594817,5.8000636
259,20210709_00:30:58,john_blaze_42,Man i really wanna go to a gun range . I haven hsot any targets in YEARS .,1,7.885519,6.646071
260,20210709_00:31:06,fecund_loin,U R U,1,7.1523366,4.818516
261,20210709_00:31:08,oboy666,tu veux tasseoir sur mon cornichon?,1,7.3864493,8.630369
262,20210709_00:31:12,queenofspuds,Discord?,1,5.595675,6.205364
263,20210709_00:31:28,lydiian,u from Jamaica? Kappa,1,5.925568,5.9600453
264,20210709_00:31:40,shakazoolahh,anyone else like zornhub?,1,7.4202285,7.0412216
265,20210709_00:31:45,king0flidl,can you loose some wait pls?,1,6.8540177,8.778325
266,20210709_00:32:00,414ufo,ARE YOU FOR ENGLAND OR ITALY?,1,7.11113,6.9982734
267,20210709_00:32:21,jhon_thicc,if you ever need a booty massage just call me,1,7.603345,8.041859
268,20210709_00:32:23,hoolaloopa,England out on penalties lol,1,7.5561657,6.337601
269,20210709_00:32:35,marfewz,Have you ever camped ?,1,-4.3437667,0.51513404
270,20210709_00:32:41,suliese,u r so guzel be,1,7.575211,5.9175577
271,20210709_00:32:43,axetr00,do you shave?,1,8.209375,8.569645
272,20210709_00:33:03,nnydust,is she bored?,1,6.5101905,8.169105
273,20210709_00:33:04,tusharjr10,Single?,1,5.6937737,5.9491453
274,20210709_00:33:07,plazye,Do you know any other languages.?,1,5.949972,7.534178
275,20210709_00:33:15,traumaticsocks,favourite quote from this chat is ‘you are fat’,1,7.748446,6.445974
276,20210709_00:33:18,thevulkanhestan,?,1,6.2019434,6.2756686
277,20210709_00:33:25,dodiesbriefs,Is your name Microsoft? Cause I wanna crash at your place,1,7.4961715,7.413949
278,20210709_00:33:35,fecund_loin,U do U,1,7.1367145,4.948042
279,20210709_00:33:37,24k_zafwashere,Pronouns?,1,5.82722,6.4030514
280,20210709_00:33:38,winterwhale,Godhyr still here? :D,1,7.0063434,7.202448
281,20210709_00:33:44,sxmii__,u do porn?,1,7.7187066,7.208608
282,20210709_00:33:49,danzig75,is your name homework?,1,6.2901564,8.375712
283,20210709_00:33:59,vexor_______,qe?,1,5.490402,6.698166
284,20210709_00:34:01,hoolaloopa,a big bank account is better than Jesus,1,7.576692,6.4935236
285,20210709_00:34:05,gringish,Can I get your onlyfans with PayPal?,1,6.8625064,8.874382
286,20210709_00:34:07,myrthe2036,hi you are really pretty,2,9.259649,5.923223
287,20210709_00:34:12,galaxietv_,subathon soon ??,1,5.892468,5.9310255
288,20210709_00:34:22,garcellito_097,wtf,1,6.5048733,4.345332
289,20210709_00:34:43,grafiticool845,Wanna get free follows? Go to *** (views DOT . run) and u can be famous!,1,6.773094,8.357834
290,20210709_00:34:55,groushx,bonito tu pelo amiga,1,8.589418,6.781552
291,20210709_00:35:01,cuhhhgg,marry me,1,6.752911,6.0262117
292,20210709_00:35:19,marfewz,Have you ever camped ?,1,-4.329967,0.528987
293,20210709_00:35:40,anonymous_91v,green warm,1,7.437037,5.2508993
294,20210709_00:35:45,zeetswyd,Algún español? Xd,1,6.5585446,6.208215
295,20210709_00:35:49,kiolokilo,so big a$$,1,7.9130135,5.223286
296,20210709_00:35:53,greentrashcan,wait do you have multiple pickle ricks?,1,5.8872046,9.195919
297,20210709_00:36:10,yogamer_ntb,is that permanent ink?,1,6.0061603,6.8823667
298,20210709_00:36:13,hola_my_amigos,can you shake your ass,0,8.398797,8.092075
299,20210709_00:36:22,t1r4n0puch1,te puedo tocar una teta?,1,7.202056,8.780967
300,20210709_00:36:24,al3111,your ass is broken,0,8.275185,5.4976215
301,20210709_00:36:30,symphony_baritone,hmmmm,1,5.4944863,5.957629
302,20210709_00:36:31,ricardomil0os,???,1,5.6302133,6.1646113
303,20210709_00:36:40,skartotv,did u guys type with one hand?,1,6.5037785,8.391774
304,20210709_00:36:47,symphony_baritone,Ammo r SMART,1,7.1620083,5.3535566
305,20210709_00:36:52,fecund_loin,TBF U R ace,1,7.2766976,5.106823
306,20210709_00:37:00,mladylana,do you like Jesus?,1,7.9774237,8.149559
307,20210709_00:37:04,krolatin,Or 100k views Hmm,1,6.2947655,6.0887337
308,20210709_00:37:05,paintrains_,Does this ass fart ?,0,8.628803,7.3918505
309,20210709_00:37:15,prodicate_,Do it fart doe?,1,8.785785,7.4497433
310,20210709_00:37:29,lix_the_goat,hi I wanna see your hourse,1,7.498416,7.9096923
311,20210709_00:37:30,two7ven,SAY HI TO MISHA YABLUNOVSKIY,1,6.719388,5.78068
312,20210709_00:37:35,clxssic22,is your a## real?,1,8.082948,8.017035
313,20210709_00:37:38,hristoe,Any gifters in chat? LUL,1,6.968975,6.388391
314,20210709_00:38:01,joaoperaro,do you was popular in the high school?,1,8.437687,8.3352
315,20210709_00:38:14,dondonthedragon,There are so many s¡MPs here,1,7.477511,6.4415298
316,20210709_00:38:22,iralideadshot1,can u ride my cucumber?,1,6.695486,9.212736
317,20210709_00:38:36,theevertonian,surely you get banned for this?,1,6.0455446,7.785286
318,20210709_00:38:54,2ocho3,cuantos bits y perreas?,1,6.202124,8.099997
319,20210709_00:38:59,dannyc_14,you are so sexy,2,9.142427,6.166113
320,20210709_00:39:04,skartotv,no is not gonna ban twitch give her feature u can see there is a hot tub section,1,8.499736,6.9812617
321,20210709_00:39:10,taonip,AMOURANTH YOU ARE CUTER THAN THAT DUMB ASS CROC,1,7.733653,6.30609
322,20210709_00:39:19,4proplayer,you are so sexy,2,9.137854,6.1800213
